### ISSUE TITLE
いきなりsocketをcloseせずに､shutdownしてからcloseする｡

### ISSUE THREAD

**Issue by JUNNETWORKS** [JUNNETWORKS/42-webserv#194]
`Keep-Alive: close` の時､ TCP Socket をいきなり `close` するのではなく､`shutdown(sock_fd, SHUT_WR)` してクライアントにこれ以上書き込むデータが無いことを通知し､クライアントが全てのデータを読み込み終わって､接続を切れると`EPOLL_RDHUP` が発行され､こうなって初めて `close` するようにする｡

[close vs shutdown socket?](https://stackoverflow.com/questions/4160347/close-vs-shutdown-socket)

**Comment by JUNNETWORKS** [comment]
[TCP/IP メモ](http://www.ne.jp/asahi/hishidama/home/tech/socket/tcp.html) によると`close(sockfd)` を読んだら､まだACKされていないパケットに関しては自動的にACKされるまで待つみたいなので､即 `close(sockfd)` しても問題なさそう｡

**Comment by JUNNETWORKS** [comment]
いやー､いろいろ調べてみるとやっぱ shutdown() をしてから close() したほうがいいかも｡
https://togetter.com/li/283316

**Comment by JUNNETWORKS** [comment]
https://network.oreda.net/tools/packetcapture/tcpdump-output

`sudo tcpdump -i lo port 49200` ローカルホスト49200ポートとの通信を見る

おー､ちゃんと Keep-Alive で最後のリクエストが処理されるまでFINが送信されてないな｡
curlはコマンドライン引数で指定された全てのリクエスト先の処理が完了したらcurl(クライアント)側からFINを送信するんだな｡
```
21:36:08.122866 IP localhost.33222 > localhost.49200: Flags [S], seq 1671701263, win 65495, options [mss 65495,sackOK,TS val 1997703713 ecr 0,nop,wscale 7], length 0
21:36:08.122875 IP localhost.49200 > localhost.33222: Flags [S.], seq 2520712847, ack 1671701264, win 65483, options [mss 65495,sackOK,TS val 1997703713 ecr 1997703713,nop,wscale 7], length 0
21:36:08.122882 IP localhost.33222 > localhost.49200: Flags [.], ack 1, win 512, options [nop,nop,TS val 1997703713 ecr 1997703713], length 0
21:36:08.122926 IP localhost.33222 > localhost.49200: Flags [P.], seq 1:80, ack 1, win 512, options [nop,nop,TS val 1997703713 ecr 1997703713], length 79
21:36:08.122929 IP localhost.49200 > localhost.33222: Flags [.], ack 80, win 511, options [nop,nop,TS val 1997703713 ecr 1997703713], length 0
21:36:09.141459 IP localhost.49200 > localhost.33222: Flags [P.], seq 1:1114, ack 80, win 512, options [nop,nop,TS val 1997704731 ecr 1997703713], length 1113
21:36:09.141475 IP localhost.33222 > localhost.49200: Flags [.], ack 1114, win 504, options [nop,nop,TS val 1997704731 ecr 1997704731], length 0
21:36:09.141594 IP localhost.33222 > localhost.49200: Flags [F.], seq 80, ack 1114, win 512, options [nop,nop,TS val 1997704731 ecr 1997704731], length 0
21:36:09.141852 IP localhost.49200 > localhost.33222: Flags [F.], seq 1114, ack 81, win 512, options [nop,nop,TS val 1997704732 ecr 1997704731], length 0
21:36:09.141861 IP localhost.33222 > localhost.49200: Flags [.], ack 1115, win 512, options [nop,nop,TS val 1997704732 ecr 1997704732], length 0
```

telnetでwebservに繋いでタイムアウトでソケットが `close(sock_fd)` されるときはちゃんとwebserv側からFINが送られてる
```
21:38:05.491306 IP localhost.33240 > localhost.49200: Flags [S], seq 243991242, win 65495, options [mss 65495,sackOK,TS val 1997821081 ecr 0,nop,wscale 7], length 0
21:38:05.491315 IP localhost.49200 > localhost.33240: Flags [S.], seq 2506030340, ack 243991243, win 65483, options [mss 65495,sackOK,TS val 1997821081 ecr 1997821081,nop,wscale 7], length 0
21:38:05.491322 IP localhost.33240 > localhost.49200: Flags [.], ack 1, win 512, options [nop,nop,TS val 1997821081 ecr 1997821081], length 0
21:38:11.518255 IP localhost.49200 > localhost.33240: Flags [F.], seq 1, ack 1, win 512, options [nop,nop,TS val 1997827108 ecr 1997821081], length 0
21:38:11.518314 IP localhost.33240 > localhost.49200: Flags [F.], seq 1, ack 2, win 512, options [nop,nop,TS val 1997827108 ecr 1997827108], length 0
21:38:11.518332 IP localhost.49200 > localhost.33240: Flags [.], ack 2, win 512, options [nop,nop,TS val 1997827108 ecr 1997827108], length 0
```

**Comment by JUNNETWORKS** [comment]
`shutdown(SHUT_RD)` は意味ないらしい

https://stackoverflow.com/questions/740817/behavior-of-shutdownsock-shut-rd-with-tcp
